{
  "schema_version": "1.0",
  "content_version": "1.0.0",
  "last_reviewed": "2026-08-29",
  "next_review_due": "2027-02-28",
  "jurisdiction": "Malaysia",
  "locale": "en-MY",
  "safety_policy": {
    "permission_rule": "A location being outside a mapped protected area does not grant permission. Show active steps only when the land or waterbody manager has explicitly authorised removal at that site.",
    "model_rule": "The vision model produces a candidate identification, not an official botanical confirmation. Low-confidence or ambiguous results must remain observation-only.",
    "protected_land_rule": "On protected land, or whenever protection or permission is uncertain, users must not touch, collect, cut or remove the plant. They may photograph safely and submit a candidate report.",
    "never_recommend": [
      "burning or fire",
      "herbicide, pesticide or chemical application",
      "chainsaws, powered cutters or heavy machinery",
      "climbing or cutting mature trees",
      "entering water, unstable banks, steep slopes or dense thorny thickets",
      "handling Parthenium hysterophorus",
      "mechanically disturbing Alternanthera philoxeroides"
    ],
    "decision_logic": [
      "If model confidence is below the product threshold or the user selects 'not sure', show identification checks and reporting only.",
      "If protected status is true, unknown or unavailable, show the protected/permission-unknown path.",
      "If removal permission is not explicitly confirmed, show the protected/permission-unknown path even when the map says the place is not protected.",
      "If guidance_mode is report_only, never show physical removal steps.",
      "If guidance_mode is site_manager_confirmation_required, show active steps only when the coordinator has marked that species as a target for that site.",
      "Otherwise show the authorised-site path, including its eligibility and stop conditions."
    ]
  },
  "sources": [
    {
      "source_id": "S01",
      "title": "Malaysia Factsheet on Invasive Alien Species in the Agricultural and Forestry Sectors 2025",
      "publisher": "Department of Agriculture Malaysia",
      "url": "https://www.doa.gov.my/doa/resources/aktiviti_sumber/sumber_awam/penerbitan/buku/malaysia_factsheet_invasive_alien_species_agricultural_forestry_sector_2025.pdf",
      "accessed": "2026-08-29",
      "use": "Current Malaysian IAS status and national context for selected target plants."
    },
    {
      "source_id": "S02",
      "title": "National Action Plan on Invasive Alien Species 2021–2025",
      "publisher": "Government of Malaysia",
      "url": "https://www.doa.gov.my/doa/resources/aktiviti_sumber/sumber_awam/penerbitan/buku/national_action_plan_on_invasive_alien_species_2021-2025.pdf",
      "accessed": "2026-08-29",
      "use": "Distribution records, policy context and earlier Malaysian IAS status."
    },
    {
      "source_id": "S03",
      "title": "Malaysia Biodiversity Information System: Invasive Alien Species",
      "publisher": "MyBIS, Ministry of Natural Resources and Environmental Sustainability Malaysia",
      "url": "https://www.mybis.gov.my/ias/",
      "accessed": "2026-08-29",
      "use": "Malaysian biodiversity status terminology and species profiles."
    },
    {
      "source_id": "S04",
      "title": "Physical control of invasive plants",
      "publisher": "Queensland Government",
      "url": "https://www.business.qld.gov.au/industries/farms-fishing-forestry/agriculture/biosecurity/plants/invasive/manage/control/physical",
      "accessed": "2026-08-29",
      "use": "Beginner-safe physical-control principles: small infestations, gloves, moist soil and complete root removal."
    },
    {
      "source_id": "S05",
      "title": "Weed control techniques",
      "publisher": "NSW Government",
      "url": "https://www.nsw.gov.au/regional-and-primary-industries/biosecurity/weeds/control-techniques",
      "accessed": "2026-08-29",
      "use": "Bagging seed or fruit first and hand-removal technique."
    },
    {
      "source_id": "S06",
      "title": "Siam weed (Chromolaena odorata)",
      "publisher": "Queensland Government",
      "url": "https://www.business.qld.gov.au/industries/farms-fishing-forestry/agriculture/biosecurity/plants/invasive/restricted/siam-weed",
      "accessed": "2026-08-29",
      "use": "Small-plant removal, regrowth and seed/fragment spread guidance."
    },
    {
      "source_id": "S07",
      "title": "Mikania vine (Mikania micrantha)",
      "publisher": "Queensland Government",
      "url": "https://www.business.qld.gov.au/industries/farms-fishing-forestry/agriculture/biosecurity/plants/invasive/restricted/mikania-vine",
      "accessed": "2026-08-29",
      "use": "Stem-fragment rooting and seed movement guidance."
    },
    {
      "source_id": "S08",
      "title": "Parthenium weed (Parthenium hysterophorus)",
      "publisher": "Queensland Government",
      "url": "https://www.business.qld.gov.au/industries/farms-fishing-forestry/agriculture/biosecurity/plants/invasive/restricted/parthenium",
      "accessed": "2026-08-29",
      "use": "Allergy risk and why hand-pulling is unsuitable for untrained users."
    },
    {
      "source_id": "S09",
      "title": "Mimosa pigra",
      "publisher": "Queensland Government",
      "url": "https://www.business.qld.gov.au/industries/farms-fishing-forestry/agriculture/biosecurity/plants/invasive/restricted/mimosa-pigra",
      "accessed": "2026-08-29",
      "use": "Thorn, thicket and seed-spread risks."
    },
    {
      "source_id": "S10",
      "title": "Giant sensitive plant (Mimosa diplotricha)",
      "publisher": "Queensland Government",
      "url": "https://www.business.qld.gov.au/industries/farms-fishing-forestry/agriculture/biosecurity/plants/invasive/restricted/giant-sensitive-plant",
      "accessed": "2026-08-29",
      "use": "Hooked-prickle, seed-bank and transport-spread guidance."
    },
    {
      "source_id": "S11",
      "title": "Water hyacinth (Eichhornia crassipes)",
      "publisher": "Queensland Government",
      "url": "https://www.business.qld.gov.au/industries/farms-fishing-forestry/agriculture/biosecurity/plants/invasive/restricted/water-hyacinth",
      "accessed": "2026-08-29",
      "use": "Hand removal of small infestations and fragment/seed spread in water."
    },
    {
      "source_id": "S12",
      "title": "Alligator weed (Alternanthera philoxeroides)",
      "publisher": "Queensland Government",
      "url": "https://www.business.qld.gov.au/industries/farms-fishing-forestry/agriculture/biosecurity/plants/invasive/restricted/alligator-weed",
      "accessed": "2026-08-29",
      "use": "High regeneration risk from small fragments and difficulty of mechanical control."
    },
    {
      "source_id": "S13",
      "title": "Leucaena (Leucaena leucocephala)",
      "publisher": "Queensland Government",
      "url": "https://www.business.qld.gov.au/industries/farms-fishing-forestry/agriculture/biosecurity/plants/invasive/other/leucaena",
      "accessed": "2026-08-29",
      "use": "Seedling hand-removal and seed movement."
    },
    {
      "source_id": "S14",
      "title": "Hairy beggarticks (Bidens pilosa) management",
      "publisher": "University of Florida IFAS Extension",
      "url": "https://ask.ifas.ufl.edu/publication/EP572",
      "accessed": "2026-08-29",
      "use": "Early removal before seed formation."
    },
    {
      "source_id": "S15",
      "title": "Guava (Psidium guajava) invasive plant profile",
      "publisher": "University of Florida IFAS",
      "url": "https://plant-directory.ifas.ufl.edu/plant-directory/psidium-guajava/",
      "accessed": "2026-08-29",
      "use": "Seedling removal, suckering after cutting and animal-dispersed fruit."
    },
    {
      "source_id": "S16",
      "title": "Tropical milkweed (Asclepias curassavica)",
      "publisher": "National Parks Board Singapore",
      "url": "https://www.nparks.gov.sg/florafaunaweb/flora/1/6/1693",
      "accessed": "2026-08-29",
      "use": "Milky sap irritation and toxicity precautions."
    },
    {
      "source_id": "S17",
      "title": "Asclepias curassavica invasive species account",
      "publisher": "Florida Natural Areas Inventory",
      "url": "https://www.fnai.org/species-communities/invasives/invasive-species?ID=16",
      "accessed": "2026-08-29",
      "use": "Hand removal guidance where the plant is an approved management target."
    },
    {
      "source_id": "S18",
      "title": "Guinea grass (Megathyrsus maximus)",
      "publisher": "Hawaii Invasive Species Council",
      "url": "https://dlnr.hawaii.gov/hisc/info/invasive-species-profiles/guinea-grass/",
      "accessed": "2026-08-29",
      "use": "Dense growth, seed production and fire-risk context."
    },
    {
      "source_id": "S19",
      "title": "Allelopathic potential of common Malaysian weeds including Panicum maximum",
      "publisher": "Sains Malaysiana, Universiti Kebangsaan Malaysia",
      "url": "https://www.ukm.my/jsm/pdf_files/SM-PDF-46-9-2017/09%20Nurul%20Ain.pdf",
      "accessed": "2026-08-29",
      "use": "Malaysian weed context for Megathyrsus maximus (syn. Panicum maximum)."
    },
    {
      "source_id": "S20",
      "title": "Crofton weed (Ageratina adenophora)",
      "publisher": "Queensland Government",
      "url": "https://www.business.qld.gov.au/industries/farms-fishing-forestry/agriculture/biosecurity/plants/invasive/other/crofton-weed",
      "accessed": "2026-08-29",
      "use": "Seed movement and small-infestation management; retained as expert context because Malaysian presence sources conflict."
    },
    {
      "source_id": "S21",
      "title": "East Point Biodiversity Management Plan 2024–2029",
      "publisher": "City of Darwin",
      "url": "https://www.darwin.nt.gov.au/sites/default/files/2025-01/East%20Point%20Biodiversity%20Management%20Plan%202024%20-%202029.pdf",